tweet_id,safe_text,label,agreement
V2K4AVMI,College Students in Required To Be Immunized Against Measles Other Diseases ,1.0,0.6666666666666666
MQFJS04K, make sure everybody gets vaccinated and checked up when I have money to spread awareness of disease and cancer EnsuranceSave,1.0,1.0
U6Y2PY00,Disneyland asked officials to say park was safe during measles outbreak Disneyland executives sent emails to ,0.0,1.0
PIA1GOUL,Sure lets expose people to measles and E Coli because FREEDOM,1.0,0.6666666666666666
R80SL26M,The article I just RTed if u choose to not get vaccinated youre being ignorant and just dont even give me the whole they cause autism,1.0,1.0
5QVP0CBQ, mos vaccines sleepy snuggly baby Perfect for outlining grant proposals MaternityLeaveScience,1.0,0.6666666666666666
DKOEF4CQ,Pretty depressing news day today train crash plane crash burning a man alive and measles Phew,0.0,1.0
YT3P3HJ4,And if yeen a big baller Iain even tryna holla ima take yo lil measles dollars and walk off like a model,0.0,1.0
2X6TSEUA,Health Officials International Traveler Had Measles While In South Florida The Florida Department of Health has ,0.0,1.0
CGRD70SR,Mark needs to add a lullaby to MMR so I can snooze to it at night,0.0,1.0
LS7PGVJK, LIES ALL LIES THIS IS FALSE VACCINES THE SILENT KILLER,-1.0,1.0
XA4PE05B,VaccinesNOVA so glad Allison shared her story about autism It is so important for parents to hear that it is not caused by vaccines,1.0,1.0
2E3XSDAR,Pa senators propose criminal immunity for kids involved in sex trade State lawmakers are following up last years ,0.0,1.0
VLZCVPW5,The Taliban is killing people who try amp vaccinate children against polio in Talibancontrolled areas Safe to say weve reached a new low,-1.0,0.3333333333333333
0SNXXY1I, pre mmr rework idk what the rework evven is,0.0,1.0
GFJ4BMRI, Vaccinations WORK U R STUPID IF U DO NOT VACCINATE UR KIDS MORE HARM IN NOT VACCINATING ASK ME I LIVED WHEN KIDS DIED,1.0,1.0
CIHGWFWZ,Fondly remembering the good old days when measles was eliminated in the USA thanks a lot AntiVaxxers,1.0,1.0
T7LZPY4K,Courts Rule Vaccines Cause Autism and Brain Damage ,-1.0,1.0
SYM6DZSM, Kid asked If yr vaccinated ampIm not HOWam I a threatu CDCwhistleblower AGREED ProudlyUnvaccinated,-1.0,1.0
FU8VWV36,No one kept my babies til they were six month old you gotta let they immunity build up fuck DAT MyrtleManor,0.0,0.6666666666666666
TQH1HBR4,No autismvaccine link study finds via vaccines VaccinateYourKids,1.0,1.0
VT5RO8K4, New Vaccine Triggers Response in of Cancer Types Health News ,0.0,0.6666666666666666
CATKUMCZ, ff,0.0,0.6666666666666666
1SX8AIWA,Idea A social media campaign like the Ice bucket challenge except with kids getting vaccinated,1.0,1.0
B9L3Z1NI,Child visiting Marthas Vineyard diagnosed with measles A child visiting Marthas Vineyard from another state was ,0.0,1.0
R0OURA1A, yep Me too better to be vaccinated though Just in case work in the health field so its sorta mandatory,1.0,1.0
E9IHPFBV,AIDS N Heres How The HPV Vaccine Can Help Cut The Risk Of Cancer In Gay Men ,1.0,0.6666666666666666
3598PITG, Children crying Vaccine Needle,-1.0,0.6666666666666666
64SFNMMN,PREVENT CervicalCancer Get your kids vaccinated to HPV,1.0,1.0
LASIRKI9, Antivaccine mothers speak out amid backlash and measlesoutbreak vaccinate your children please,1.0,0.6666666666666666
TAYELLJZ,The three Msmumps measles and midterms,0.0,1.0
SV7SFTZF, So both the CDC and the vaccine insert are wrong,1.0,0.6666666666666666
E6PEDT5L, the whole vaccineautism link allegation began with a fraudulent paper by Andrew Wakefield ,1.0,0.6666666666666666
L0BOCIN9, and a poorly educated populous makes stupid decisions like not vaccinating their kids and voting against their interests,1.0,1.0
DUD2WTUE, The Measles story is pretty wild hope it doesnt spread for peopleWet Concerts sucks lol,0.0,0.6666666666666666
P5VO7KDT,Arizona classrooms vulnerable to measles outbreak The Arizona Department of Health Services looked at herd ,0.0,0.6666666666666666
FB1WH2HJ,Welcome CA where you can have an abortion but not decline a vaccine if you do NO School WeAreNotGoingAway ,-1.0,1.0
6YD13NF6,If we keep letting in illegals without testing measles and other diseases will be on the rise,1.0,0.6666666666666666
J39KOUBW, scaretacticFinishIn developing countriesNO MMR deaths in US for yrs deaths wMMR vaccine,0.0,0.6666666666666666
JDGU1LV7,All you parents not vaccinating your kids feel free to just walk off the edge of the Earth,1.0,1.0
LSRNMJQA,Jus took nd mmr shot health dept n the nurse askd how I handle da st Idk since it was back n Smh while lolsort of ,0.0,0.6666666666666666
6W5YCJ6F,He that overcumeth shall be immunize unto the second death,0.0,1.0
8RLTOHXT, Help save m kids lives Pledge bill over the next yrs to the Vaccine Alliance everyparent ,1.0,1.0
6GPE5NLO,MMR shot lads MMR shot ,1.0,1.0
RCRNFDJE,Fucking Measles Who tf gets measles,-1.0,0.3333333333333333
NYUVN6GP, I agree with you but parents should have to vaccinate their children,1.0,1.0
7XCKHR54, People who complain live longer Releasing tension increases immunity and improves overall health c I knew it,0.0,1.0
CWKA8IEK, ZOMBIE ALERT New Ebola vaccine is the its inside all of us from The Walking Dead TheWalkingDead ZombieApocalypse,0.0,1.0
UNE5TCCY,Waiting in isolation Portage County keeping close eye on possible measles cases The disease has been spotted in ,0.0,1.0
1F3GJLD4,Santa clara county public health officer says flu death in co was year old woman Some pharmacies are reporting running out of vaccine,0.0,1.0
DKAVTRDL,CDC says flu shot less effective while health officials push Hoosiers to get vaccinated There have been ,0.0,1.0
OUQ4A7S6,AIDS N BioArt Katharine Dowsons Brain Boxes Crystal Chromosomes amp HIV Vaccine Work ,0.0,0.6666666666666666
6W8Y4PIZ,Face palm RT Tea Party BS RT TX Senate health chief opposes bill to limit vaccine exemptions txlege,1.0,0.6666666666666666
95E2617Q, Good deal We need to make sure hes as immunized as possible since hes boarding Hes a great kid No worries here,0.0,0.6666666666666666
V2RQT6BA,Update bronchitis roommate now thinks she has measles In other news Im dropping out of college bc I hate living with this girl,0.0,1.0
TXCNMGRH,California approves bill banning child vaccine exemptions ,1.0,0.6666666666666666
R0VWUFDD, autism The child is already autistic but vaccines can exacerbate the behaviors that people associate with autism Its,-1.0,0.6666666666666666
TUR37NG4,Omaha Jackrabbit nebraska gravel mmr teamdundee Village of Kennard ,0.0,1.0
CFIF9RPO,Measles scare at Sharp Grossmont Hospital ER ,0.0,1.0
0WKSH5HI,Gardasil Vaccine Victims and Deaths Did You Kno Whats more important to you,-1.0,0.6666666666666666
9ZB3XUMM,Come on folks get your kids vax MT Hi meet Mickey heres some measles ,1.0,1.0
0W5FT3J3,You say your pockets got the mumpsits more like the measles lmao,0.0,1.0
5CE19OXB,Willing to pay for poison ivy vaccine,1.0,1.0
Z37SP2Y5,New immunization requirements in Maryland Students here in Maryland will be heading back to school in the next ,0.0,1.0
IVAOILVP,AMNews Week Ahead EHR in the ER HIV News Docs on Measles Vaccine Week Ahead EHR in the ER HIV News Docs ,0.0,1.0
E9FVT7IT,What the hell I have to go to the hospital bc my roommate might have the measles,0.0,1.0
OZZ4M7ET, RT mmr lol,0.0,1.0
3DX4HUOZ,Last round of vaccines for my doubletrouble babies Quality Care Animal Hospital ,1.0,1.0
Z0SM0XLD, you should have gotten vaccinated for meningitis prior to school however there is viral and bacterial which only is vaccinated for,1.0,1.0
4PGZQMWD,Boom mmr dc dj mixmasterrod top edm live dupontcircle flyer photoshop ,0.0,0.6666666666666666
DC47GTUC, This is what happens when parents refuse to vaccinate their children,1.0,1.0
FDJ4PLKR,Vaccine Study Supports Immune Targeting of Brain Tumors ,1.0,1.0
CP8G98D5,A my hope is school is a vaccination from standardized everything for individual learners weirdede,1.0,0.6666666666666666
GF780FXO,I love that parents can now threaten their kids wa trip Disneyland if they act up You behave or I will let you catch the measlesl,0.0,1.0
MTDSZ13Z,I feel the slapping is a vital step shouldnt it be a robot that vaccinates you against measles,1.0,0.6666666666666666
6WOTWCIX,I credit my strong immunity system to sampling the communal lipsticks at the Lancme counter in high school,0.0,1.0
YGEE2G4Y,AIDS N Why Patients With HIV May Need Additional MMR Immunization ,0.0,1.0
XQMYUJL3,New Choices For Seasonal Flu Vaccines WebMD Health NewsBy Brenda Goodman MAReviewed by Michael W Smith ,0.0,1.0
2OWWLUOK, Handwashing could save more lives worldwide than any vaccine according to a study by the World Health Organization Do it,0.0,0.6666666666666666
DECHF0SO,We drove by Walgreens and Barbara said School Immunizations Does that prevent you from going to school,0.0,1.0
88Q80C2A,no no no no NO proven medical correlation or even a strong speculation of a relationship between vaccinations and autism no no nooooo,1.0,1.0
4A9CKV5C,Just because you dont see vaccine preventable diseases doesnt mean they dont exist Prevention works Get your kids vaccinated,1.0,1.0
HNJ8OGI6,Screw you Measles case confirmed in U of M student ,1.0,1.0
YA3FFTB8,Most measles cases in seventeen years Please get vaccinations Thanks Jenny McCarthy ,1.0,1.0
X9C8M495,AMNews New HIV vaccine candidate raises infection risk AGAIN there appears to be no light at the end of the ,-1.0,0.6666666666666666
3A82YH5A, maybe for certain ones but is there really any reason not to get a measles one Like cmon that disease should be dead by now,1.0,1.0
3J6QPIX8,Oh no Avrils fallen victim to markeritis This should have been totally preventable Vaccinate your kids now ,1.0,0.6666666666666666
0HJJUF0M,Del mental health study group OKs proposed immunity provision for peace officers doctors screeners amp facilities Recommendation due Jan ,0.0,0.6666666666666666
CRS284RM,People getting vaccinated thinking they safe are just getting infected with Ebola,-1.0,1.0
G5Y35JOY,He said Shawty what you sippin on HennyInMyCup WhySoThick MMR ILuvvIt pulseonwed Pulse ,0.0,1.0
DKNF5BRE,O Im gonna be dreaming of gas exchange and Kidney function and immunity and neurons tonight burntout,0.0,1.0
FT5779PI,White House Science indicates parents should vaccinate kids ,0.0,0.6666666666666666
M627J9FA,Common Infant Vaccine Tied to Slight Rise in Risk for Bowel Complication ,-1.0,0.6666666666666666
DU9YWAET,Today I learned the nbr amp causes of death and illness in many South American countries traveldoctorvisit immunized,1.0,0.6666666666666666
IG47OTTR,At this daycare the kids rock out to Korn progressive vaccinated ,1.0,0.6666666666666666
S4BCDJ5U, on Thursday on Friday on Saturday mmr FLYORDIE Weekend ,0.0,1.0
6D03MEDF,The fella with the shingles on the tv ad is freaking me out Is BigPharma using extreme scare tactics so I will get a vaccine Surely not,-1.0,0.3333333333333333
L860ZX1L,This week Im writing about the wonders of virtual reality and reading about a measles vaccine curing cancer So many wonders,1.0,1.0
KVEZT1TQ, Not only do vaccinations fail to prevent disease they are proven to cause disease Please consider reversing your position,-1.0,0.3333333333333333
I0PO6LGR,I mean is the notion of having an autistic child so awful that one would be willing to risk them DYING of a vaccinepreventable illness,1.0,1.0
UTF4OZPY,Friday night Astro WeAreAE bnation reedypowered jconcepts MMR ,0.0,1.0
5LHW5IMM,The isolated measles outbreaks could be so much worse if people just stop vaccinating their kids People die from this its not a game,1.0,1.0
SM5DQB97, she look like she got the measles or some shit,0.0,1.0
PFHED335, agree Vaccinate your kids Dont expose my kid to your stupidity,1.0,1.0
1TWXE28D,There is nothing scarier than reading the reasons parents give for not vaccinating their kids,1.0,0.6666666666666666
WBOCDLK3,MMRBQ m ,0.0,1.0
VKGBTHYN,Thank you and for fighting for healthy CA children for your leadership on SBVaccinesWork,1.0,1.0
F94I4925,Doctor versus doctor over whether to treat those children whos parents elect NOT to vaccinate tonight,0.0,0.6666666666666666
VMF6FYL1, Hard data needed to support vaccine safety question Vaccines beneficial Roundup likely not,1.0,1.0
8D66J1XZ,RT Measles has reemerged as a public health issue because many people choose to remain unvaccinated ,1.0,0.6666666666666666
XXCWR0IX,YeaIGoByDibiHoe Just felt like sayin it since cuddy got me out MMR SupaTeam,0.0,1.0
RG889QS6,Washington state panel mulls bill to trim vaccine exemptions Personal or philosophical opposition to vaccines ,0.0,1.0
30XHZJRO, Get Mercury out of vaccines Isnt there another way to store or stabilize vaccinations,-1.0,1.0
TEBWC9QE,State budget deal amp gas tax hike Senate immigration reform bill NFL criminals Bellingham measles and more next hour on the Morning Show,0.0,1.0
2HPWG76D,Local family with boys who have not received a single vaccine because of the government conspiracy to cover up Vax risks I cant even,1.0,0.6666666666666666
53FMM3C5,Omaha Jackrabbit nebraska gravel mmr teamdundee Herman Park ,0.0,1.0
NKLNZ8FY,Really Person had NO clue what measles was U can guess where I wont go vaca ,0.0,0.6666666666666666
LD1F1JFF, Might as well call you measles Cus youre infectious and airborne,-1.0,0.3333333333333333
9Q13B59P,ILoveObama Because he is a Good Man in A den of vipers I hope Bonehead amp Net an Yay Who catch the Measles,0.0,1.0
3VND7OQT,Why is there an actual debate on vaccinating your kids Its a nobrainer Like calling running plays from the halfyard line,1.0,1.0
GI2TH8CS,Once again pay attention now THERE IS NO LINK BETW AUTISM amp Vaccines ,-1.0,0.3333333333333333
2W171AND,Basic bitches Annoy me so much more now that the immunity is gone from high school,0.0,0.6666666666666666
RFQ34ECW,Why One Family At The Center Of The Measles Outbreak Is Reconsidering Their AntiVax Position ,-1.0,0.3333333333333333
N8471SJX, we parents Not so crazy after all Prepost MMR CDCwhistleblower ,-1.0,0.6666666666666666
ZXHX29G8,Wonder how many measles cases are walking around heresure are plenty of sick candidates at ,0.0,1.0
0B1S5TGI,Down The Health Department Getting Immunizations For School These MFs Look Like They On The Verge Of Death ReadyToGo,1.0,0.6666666666666666
2WJNFNTG,Drop In Vaccinations Linked To Spikes In Preventable Diseases Around The World ,1.0,1.0
IA4BTV1A,Another Study Finds No Link Between MMR Vaccine and Autism ,1.0,0.6666666666666666
TSRWJC99, On average people who complain live longer Releasing this tension increases immunity and boosts their health ,0.0,1.0
JH4UU4FI,IS has measles,0.0,0.6666666666666666
Y8J1Y3QS, I hope your shitty little kids get measles,1.0,0.6666666666666666
1ZZ24Z1J,Getting my immunizations for school tetanus tdap meningitis hepatitis Needles eek ,1.0,1.0
VDR0F3A8,Flu shot less effective this year because current flu virus has mutated CDC says This years flu vaccine is not ,0.0,0.6666666666666666
B7IC2ATM,Dreamt there was a measles epidemic and passed it on to me ,0.0,1.0
SDKR38PH,As the parent of an autistic child I can assure you that Id vaccinate again because Im a grown man not living in the dark ages Not real,1.0,0.6666666666666666
3L0B5XNW,Anyone in AC tm afternoon Come play at the trump with other pamps girls in bikinis at the MMRs Day off down the shore ,0.0,1.0
4N839LR7,First measles case reported in Georgia thisscaresme,0.0,1.0
GPQMLPP4, prayin for him They give Vaccine for chicken pox now so its very rare that kids catch it Not saying they cant its just rare,1.0,1.0
M1FJ55XV, Shes the babykilling bitch who led the antivaccination movement based on a study that fraudulently linked vaccines to autism,1.0,1.0
AYYA7SVR,Its come to this White House Urges Measles Vaccinations As Number of Infected Passes ,1.0,0.6666666666666666
Q2140FZ8,vaccinations for Peru Dean Health Care ,1.0,0.6666666666666666
2XVCMHTZ,My weapon of choice the measles ball golf westchester gkmobile Westchester golf course ,0.0,1.0
IWK3PDE9, On average people who complain live longer Releasing this tension increases immunity and boosts their health yay me,0.0,1.0
XYZRU6K3, Im just glad the government didnt kidnap me to make vaccines from my blood ,0.0,1.0
CLSMOD0A,New studies show that vaccines are not associated with autism In other news the sky is blue,1.0,1.0
6VG99UDS,Why we didnt vaccinate our child vaccinations medicine children,-1.0,1.0
P4WX8EP7, Dr Reveals truth about vaccines,-1.0,0.6666666666666666
0VYN2584, Hannah Poling was compensated in the millions by the US vaccine court her autism So they admitted it,-1.0,1.0
N56Z3HS4,Disneyland Measles Outbreak May Have Originated in Philippines As California health officials search for the ,0.0,1.0
324AS3S9,Pray the Pearsons Texas Measles Outbreak Linked to Church Led by Kenneth Copelands Daughter Infection Spreads ,0.0,0.6666666666666666
8OCYLR4F,No not getting your kids vaccinated is a great idea yes big pharma is just trying to hook them like a pusher in a s PSA aprilfool,1.0,1.0
HYGY8IIJ,More Measles Cases Expected In Tarrant County FORT WORTH As North Texas parents get ,0.0,1.0
YWKN3K9S,Ebola Ebola Affected countries are likely to have a measles outbreak US researchers Pulse Nigeria ,0.0,1.0
AF4WBF3I,If your child suffers from ADHD asthma allergies or autism see BoughtMovie and you will be pissed Monsanto VaccinescauseAutism GMO,-1.0,1.0
XPXO32ZB,like you can google what measles are why are you asking the nurse ,0.0,1.0
YPROXDHE,Im never going to go back to Disneyland measles,0.0,1.0
0VXI2LEM,Isnt it interesting that public health officials never promote the various proven ways to avoid the flu other than through vaccination,-1.0,1.0
D3JXXDTQ, talk about ridiculous framing Article should read over of Americans think vaccines are safe,1.0,1.0
RJB7QRY2, vaccinations cause many problems in old age I dont get them nor do my children were fine thank you,-1.0,1.0
EW36A1KU, I used MMR for a few months but went back to after getting a better phone GPS uses up battery in general though,0.0,1.0
ZYPAMCOX,Initial outbreak of measles was at Disneyland,0.0,1.0
VA5M16DO, that would make her a liar I believe And if u think shes not getting some form of immunity I got land sale Truthright,0.0,1.0
I7EREYA8,Childhood immunization rates at st STEPS practices up over months Great news from the Harvest Conference ,1.0,1.0
JHBY3LG3,King County health officials warn of possible measles exposure King County health officials say a child with ,0.0,1.0
388E7E9I,Catios MMR,0.0,1.0
Y6PEXP67,Study of more than kids finds no link between MMR vaccine and autism ,1.0,0.6666666666666666
26YYN5DT,Vaccines Vaccines galore Beaver Health Mart in Beaver PA ,1.0,0.6666666666666666
NITP69Z0, Thought ud find this interesting as a flu shot enthusiastChattanooga man paralyzed after getting flu vaccin ,-1.0,1.0
0DCTR0U9,quot RT CDC recommends HPV vaccination for boys cancerquot,1.0,1.0
UWJZP72D,HB Update Providing for hospital care or assistance necessitated by traumatic injury immunity ,0.0,0.6666666666666666
RE6C4TTL,Worried Youve Been Exposed To The Measles ,0.0,1.0
M3AOW4Y4, On average people who complain live longer Releasing this tension increases immunity and boosts their health,0.0,1.0
KBS22V6Q,Vaccinate your damn kids or dont fucking have them Period,1.0,1.0
NNVWYV7C,travel jobs Travel Immunization Nurse Specialist Passport Health Travel Medicine Philadelphia PA ,0.0,0.6666666666666666
UZUPT0RZ, take emergen C when you start feeling sick works wonders and I even am around sick kids everyday immunityboost,0.0,1.0
VTJ7SNQ1,Measles outbreak growing at least people in states infected ,0.0,0.6666666666666666
UT1OZXFW, The belief that vaccinations cause autism or brain damage is wrong and dangerous ,1.0,1.0
V0FU7U9T,Only souvenir from FL bug bites I look like I have measles Time to hit the tea tree oil,0.0,1.0
ISZ1P17F,Vaccinations Inject or Reject Issue Forum at Multnomah County Building They have proven themselves to be safe pdxcityclub,1.0,0.6666666666666666
59FMV4QJ,Muppets Marvel Star Wars now measles Disney owns everything,0.0,1.0
9FZUI8ZI,Measles in Framingham Another reason why I hate this place,0.0,1.0
8XUBKOK8,Geof leading the cheers circa UCLA USuCk Troy Aikman vs Rodney Peete measles Thank you Geof ,0.0,1.0
E0VDEYR1, I have a friend that home schools and doesnt vaccinate but not sure they would share their story,0.0,0.6666666666666666
0S6Z7F61,Health officials warn San Francisco BARTriders of measles exposure ,0.0,1.0
VVTIXKKG,Hey get your kids vaccinated so those who dont have strong immune systems because of medications dont have to suffer Thanks,1.0,1.0
D85ALY09,My brother came chill wit the kid MMR PopularNobodies The Key Club ,0.0,1.0
0XVFX2F8,I think facing a mandatory quarantine from school if exposed and not vaccinated would change some minds weirdede,1.0,1.0
8NV9NKQN, I think if dont vaccinate ur kidThats fine If ur kid gets sick cuz of it we just have to put them down,1.0,1.0
9N46OULD,Marin vaccine skipping raises concerns of polio resurgence The measles outbreak originating in Disneyland brought ,1.0,0.6666666666666666
841RU7GL,H Enroll Immunity from Liability for Providing Free Health Care Services ,0.0,1.0
WN73MQPZ, Injuries amp death from HPV vaccine Heres article out of many from a simple Google search ,-1.0,1.0
X1XMNAZ4, yoga teachers dont make enough money to not believe in vaccinating kids Wifes a yoga teacher and kid is fully vaxed,1.0,0.6666666666666666
0R6SCQ5X,Im a busy bee Getting my MMR titers drawn Labcorp in Henderson NV ,0.0,0.6666666666666666
ELKJCHAK,Epic convo Ahh hes harmless If youre vaccinated,1.0,0.6666666666666666
AZFPWYPF,so I dont have to get another MMR vaccine we all get them shit when were little wtf,0.0,1.0
YSIB1L9A, I knowI guess I have to build up an immunity to kid germs,0.0,1.0
FRMIAH2T,I need to go to Disneyland before my pass expires this week but my grandma doesnt want us to go bc of the measles outbreak ,0.0,1.0
OYEXZBRI,Vaccination debate NHC experts encourage parents to immunize kids ,1.0,0.6666666666666666
H7TIVDCV,Oh yeahparents should be free to not vaccinate but women cannot make decisions about reproduction and health whenwillitend,0.0,0.6666666666666666
2W4ML17D, tells advocacyhealth GAVI is one of greatest global health stories cut vaccine cost by ,0.0,1.0
K225HPSE,CDC has changed recommendation for getting infants vaccinated against Measles My report next on Fox or watch on ,0.0,0.6666666666666666
UXY6DZ2I,Infant in Georgia diagnosed with measles California Atlanta ,0.0,1.0
SD1W8P09, has anyone connected measles with an ongoing flood at our southern border cluelessPOTUS,0.0,1.0
UXZ0499M, of Californias measles cases intentionally unvaccinated ,1.0,0.6666666666666666
A2RXUT0L,Baltimore has been lucky to avoid measles health commissioner says There hasnt been a confirmed measles case ,0.0,1.0
EXBMA5N2,Why its important SWFL families protect their families from the measles virusIve got the answer coming up in ten minutes ,0.0,1.0
A0ITIBYG,people who dont vaccinate their kids because they believe in dumb conspiracy theories that have been proven to be untrue piss me off,1.0,1.0
RY38P9RW,I HATE that I learned this on Fox News But i did My doctor can check to see if Im still immune to measles ,0.0,1.0
R1UXO7LA,In Pakistan vaccinating children has become a deadly battle While vaccine distrust has sparked debates amid a ,0.0,1.0
0LNN33KA,Two things Vaccines were made for a reason amp death row inmates are there for a reason if they suffer in their last moments so what,1.0,0.6666666666666666
YJSTLJX4,Love me some mmr,0.0,0.6666666666666666
MIPDWY5Y, absolutely It only takes a vaccine but parents today are more ignorant than forty years ago and put others at risk,1.0,1.0
JHYQGFIV,Instead of focusing on a healthy diet to improve the immune system just take our vaccines so we can make money off of you the CDC,-1.0,1.0
Q46DPV34,jeffkoonsstudio and simondepury selling hermes readymades to fight measles The Four Seasons Restaurant ,0.0,1.0
UUJN5FN5, A child can have a lethal reaction to a vaccine This was Bachmann at her human best,-1.0,1.0
NVMLNM96,you know youre a s kid when your vaccinations were MANDATORY TO BE IN SCHOOL and no one brought home MEASLES,1.0,0.6666666666666666
HIXUTWPP,My BF from high school wont MMR vax her kids and I love to rank on her so i bought her a lovely shirt for her bday ,1.0,0.6666666666666666
SLLZP3GF, she has this rare disease so they kicked her out of school and made her go to the doctor to get a vaccine,0.0,1.0
PKH5INX4, a disease with a mortality rate with no treatments or vaccine that isnt in the US yetuntil now Its destroying Africa,-1.0,0.3333333333333333
9QGQM10J,Baltimore Health Officials Urge Parents To Vaccinate Kids Pediatricians from Baltimorearea hospitals and the ,1.0,1.0
SFDIUBMX,Do you know the truth about the connection between vaccines and autism Hint Science knows via ,-1.0,0.6666666666666666
X94UGLYI, Womans cancer wiped out by giant dose of measles virus RT amazing,-1.0,0.3333333333333333
NG41YFG4, then keep your babies in your house and stay away from us You risk giving us polio measles and whooping cough,0.0,1.0
VTRN0SXP, Knowing HPV exists is one thing what to do about its another Really push children to get HPV vaccine so this test neg,1.0,0.6666666666666666
ZSDFYLPJ, This how parents handled mumps where there was no better option Now its just plain stupid Measles can be dead serious,1.0,0.6666666666666666
ON5S11AK,Why isnt the news talking about how measles were wiped out AND THEN CAME BACK cuz dumbass ppl dont vaccinate their kids,1.0,0.6666666666666666
Y5DYKI0W, unless Jenny McCarthy writes a book entitled Im sorry I helped spread whooping cough and measles is better,1.0,1.0
IMK2ZTG9,Flu Vaccine Prevented Million Illnesses Last Season CDC ,1.0,0.6666666666666666
IKDN50M5,Why you should vaccinate your kids via ,1.0,1.0
S0V7GT6P,I had measles when I was It didnt make morning news,0.0,1.0
