tweet_id,safe_text,label,agreement
QJF59CKK,The CDC Says The Flu Vaccine Is Less Effective Than Expected ,0.0,0.6666666666666666
H9CSEGDD,parents have to fear sending their children to school because they might catch the fucking measles and die its a joke right,1.0,0.6666666666666666
O3E0E67W, Childhood vaccines news,0.0,1.0
W47JBMFJ, Why are all your arguments name calling and accusations My kids got their vaccines and do not smoke pot thankfully,1.0,1.0
S16YUUX4,How convenient CDC Says Ebola Vaccine Only Works on White People ,-1.0,0.6666666666666666
YCDUI7UE,Repeal Immunity for Drug Companies Against Vaccine Injuries No Liability sloppy science CDCwhistleblower,-1.0,0.6666666666666666
UUMZ7A5W, all made more poignant by the fact that measles was no longer endemic in US in Such a step backwards,0.0,0.6666666666666666
PK313VSZ,Would you rather have a kid dead from smallpox or a healthy autistic child Just kidding vaccines dont cause autism win win,1.0,1.0
4J49MFLL, we gonna fry mmr this weekend,0.0,1.0
HHJXLPQF,When I hear about the measles outbreak at Disney I just think thank god I didnt get it considering I was at Disney right before,0.0,1.0
7PH7BTKI, Stupid ass people think that vaccines are good for them and their babies because its fda approved,-1.0,1.0
Q9C5TABK,Access to Fitchburg school is limited amid measles scare Most read by neighbors in Fitchburg MA,0.0,1.0
QQY1DSLW,Stopping to eat in Ashland OR a lovely town notable for the highest child vaccination optout rate in the country Sciencehatin hippies,1.0,1.0
SUULJQFN,Measles outbreak in connection with DisneylandI knew I didnt like that place,0.0,1.0
TK2GSISL, Does Autism Speaks espouse antivaccination views like the NAA,-1.0,0.3333333333333333
KSAZ30OD,The Disneyland measles outbreak is finally over in the US AssociatedPress Facebook ,1.0,0.6666666666666666
V4WTNFOA, My brain is dumb sometimes I get inflicted with the dumb quite often Youd think Id have built up immunity by now,0.0,1.0
CHNKQW6Z,Officials suburban Chicago residents have measles Health officials say three more cases of measles have been ,0.0,1.0
QS5WM750,Just got proof of my MMR shots Yay Herando county school board office pic ,1.0,1.0
4UF5LWRU,GOP Agenda deny health insurance no birth control encourage people to not get vaccinated SeemsLegit p UniteBlue,1.0,0.6666666666666666
9EVOJVQ5,We make the immunization to deal with every strain of imbecile DeathWishCoffee Death Wish Coffee ,0.0,1.0
UX47OSL0, small pox is the ONLY disease that has been eradicated worldwide Doubt vaccine was only reason,-1.0,0.6666666666666666
U5D05F1H,Apparently theres a measles outbreak in the area because some parents decided not to vaccinate their children Are you kidding me,1.0,1.0
HSH8IYP9,Check out the wonderful posters we made today for the Measles Initiative ,0.0,0.6666666666666666
OKYN1OFA, New Cases Of Measles Reported In North Texas Counties NORTH TEXAS Officials with ,0.0,1.0
WKPASG3Q,ELB Measles is Not a Mild Disease Measles Is Not A Mild Disease I had measles when I was eight years old In those days Massach,0.0,1.0
H210N9L9,So we need to quarantine her Pregnant reality star does not believe in vaccinating children ,1.0,0.6666666666666666
RW6ZG1JK,Is there a link between the measles outbreak and illegal immigration No but it doesnt stop right wing politicians,-1.0,0.3333333333333333
JI78SBNM,so apparently i have to get a meningitis vaccine before school starts or i cant get my books amp schedule wth thats fucked up bro,-1.0,0.6666666666666666
2J1D9LJP,Measles outbreak in Berlin because of unvaccinated adults and kids Though not directly AntiVaxxer fault this is the reality they support,1.0,0.6666666666666666
2GX3B4OI,Screw you Gov Rick Perry The vaccination of children is a decision that should be left up to parents not the govt mandatoryHPVvaccine,-1.0,0.6666666666666666
G6D6SGEV,Denton County health officials urge residents to get measles vaccination in lieu of confirmed cases Five ,1.0,1.0
5W3QRX9J,I literally dont understand parents who refuse to give their children vaccines,1.0,0.6666666666666666
U7PAJLBV,Another Study Finds No Link Between MMR Vaccine and Autism ,1.0,1.0
PQ0QURRR,According to the letter I just got from the Michigan department of community health I havent gotten an immunization since January ,0.0,1.0
SE7E06QK, antiGMO movement is just as antiscience and reactionary as those who blame autism on childhood immunizations,1.0,1.0
I87OO9HY,MMR on the radioOhhhhh Im getting close now excited,0.0,1.0
YY1TU54P, mmr for next season No new rewards just like last season,0.0,0.6666666666666666
I8KQ67P2,WHY PEOPLE RT k NY school kids arent vaccinated Look up any NY schools vaccination rate here ,1.0,1.0
K6XGP99P, wasnt it when IOM first concluded MMR vax doesnt cause autism,1.0,1.0
KH7DBUJY, GOP STOP blaming Immigrants first Ebola now measles Which diseasesbrought their ancestors AINF ,0.0,1.0
G0K1G8MN,Karen from the Howard County Health Department will be in studio to give us updated information about vaccinations,0.0,0.6666666666666666
9JMTKLAS, Vaccines Protect the Youngest Babies flu vaccine for pregnant women and rotavirus vaccine for infants ,1.0,1.0
EDZEGVQV,Jenny McCarthy does ecigarette commercials and doesnt immunize her kids hahahahah good night everyone,1.0,0.6666666666666666
FWFJGEM9,Mogul Media Records Present Jennifairs hot single Paranoia Comsumes MMR ,0.0,1.0
RIMS92KU,Many younger parents amp their gen have not experienced the devastating efx of these diseases smallpox measles vaccinations npr,1.0,1.0
TVGA8FUK,Tarrant County Measles Cases Linked To Church Members Missionary Trip TARRANT COUNTY ,0.0,1.0
ZIS7IB3X, that would be the result of lower vaccination rates Its measles now but thats not the only threat Out of sight out of mind,1.0,1.0
KC6NL1G0,Im late bt still time headed take the kidsget their flu vaccinesplease all let go of the mythsget tht flu vaccine its killing people,1.0,1.0
7OE9F8ZT, I didnt tell anyone not to get vaccinated I just scared them with fake risks Duh mccarthylogic,1.0,0.6666666666666666
T9R2UVYG, are talking about getting different vaccines to protect yourself from diseases amp illnesses Watch TheDoctors GetVaccinated,1.0,0.6666666666666666
HRPFNSBO,Did you know if you are not from this country you dont have to get your shots That means I could go to college amp get the measles,1.0,0.6666666666666666
MI7XIH17,Eugenics and Vaccinations Campaigns are wars aimed killing Gods Chosen PEOPLE which are Brown Red Black and Yellow Peoples,0.0,0.6666666666666666
O2OPIX2I,Vaccine baby ,-1.0,0.6666666666666666
SJSH08RB, Vaccinate your kids you idiots,1.0,1.0
N8BY3OJW,I thought doctors and nurses only lie to kids She said my left arm will be sore tomorrow due to vaccinations It is sore like a bitch NOW,1.0,0.6666666666666666
0KM24I6H,Waiting for to take the stage brings complete concert coverage MMR winners here ,0.0,1.0
D87LBQF9,Anyone who spends time with your newborn needs a flu and pertussis vaccine Protect your baby prevention Vaccines,1.0,1.0
5FICIUVB,Lake County Patient Suspected of Having Measles ,0.0,1.0
16M96G8U, Where measles cases are reported and how the current outbreak compares Vaccinate,1.0,0.6666666666666666
VC4GD3NO, How Could You Put Ur Child In So Much Danger Most Of The Diseases That They Have Vaccines I Had Measelsx Vaccinate SavesUS,1.0,1.0
GHHQTC0W,Vitamin A supplementation in developing world lowers mortality from measles Diane Griffin Measles ,0.0,0.6666666666666666
NGHS9EE5,DPH Reaching Out To Patients Possibly Exposed To Measles BOSTON CBS The Department of Public Health says a ,0.0,0.6666666666666666
9XN4C7G1,HB NEW Immunity for accepting certain abandoned children Provides immunity to an emergency medical service ,0.0,1.0
HYDLOGP5,People from NY Boston subjected in measles bowl village outbreak ,0.0,1.0
QLFGNSCB,Ashamed of Oregon MT How Many People Arent Vaccinating Kids in Your State ,1.0,1.0
CAPZ6IJL, important questions about measles B vax measles affect pregnancies,0.0,1.0
K0VFQTMJ,Had to come take a blood test since I could not fin my immunization records ASU Campus Health Center pic ,0.0,1.0
VO19FXEW,Ethiopia immunization Measles Mumps Rubella Part ll BAM at Dallas County Health Human Services ,1.0,0.6666666666666666
MV6UM61W,Crowded Bart Ughh I hope I dont get measles,0.0,0.6666666666666666
3UQ3D3S1,To the parent of an unvaccinated child who exposed my atrisk kids to measles via ,1.0,1.0
5SKJDH44,Good Exempt from vaccines exempt from school Period California Moves to Ban All Vaccination Exemptions ,1.0,0.6666666666666666
A6DYX8L3, On average people who complain live longer Releasing this tension increases immunity and boosts their health woohoo,0.0,1.0
07S3NL2T,Baby Luna is sore from her vaccines poorpuppy,0.0,0.6666666666666666
SS19856O, I never had Beiber fever I had Maslow measles hope that made u smile or laugh I love u lots rock out night xoKarina,0.0,1.0
41URLZBO, HBs going to give us measles ,0.0,1.0
L8TY7ZOR,I love how all this antivaccination crap comes from people who were vaccinated Just come on guys Dont be idiots Vaccinate your kids,1.0,1.0
3KGWCZZA,Cada Dia Combo vaccine causes Autism My son Elijah who was taken from me out of state by my wife has been diagnosed with Autism ,-1.0,1.0
GGO2U3XV, wasnt measles eradicated in ish,0.0,1.0
7YY4RT28,Measles Outbreak Expands Into San Bernardino County ,0.0,1.0
ZAFMO1TM,Jim Carey and Jenny McCarthy cause st confirmed measles death in US in years Thanks ,1.0,0.6666666666666666
K7J9C2H0,Mike Drago You want freedom not to vaccinate your kids Then I should know who you are Somethi Plano News,1.0,1.0
8P0R2S1A, oh did u see the tweet abt aborted babies in vaccines geez,0.0,1.0
H6ADBM2U,Boyhood like measles is one of those complaints man should catch young and have done with when it comes later it is apt to be serious,0.0,1.0
VA8FGU9M, very likelyalthough the vaccine didnt exist when we were kids Docs gave me Zostavax after it was approved in ,1.0,0.6666666666666666
I81EUHIP,Yes you should vaccinate your kids so they can grow up ,1.0,1.0
LGPTVG2P,NEWS FLASH We have a measles outbreak in the USA because Obama invited tens of thousands of illegals from Central America to come here ,0.0,1.0
81PFI5OA, people who dont vaccinate their kids shouldnt have kids,1.0,1.0
34P1UVEN,I think MMR has the intern on the air This guy sounds stiff as a marble statue,0.0,0.6666666666666666
DSLC1Q1Y, the vaccineautism claim was by a study published by Andrew Wakefield later to be shown to be fraudulent ,1.0,0.6666666666666666
FEWC8OJT,BREAKING NEWS Fifth measles case confirmed in Clark County A fifth measles case has been confirmed in Clark ,0.0,1.0
KJUN2BIP, m here for chicken pox n mmr vaccines i need dat stupid to get rid off my hold otherwise i wont b able to enroll,1.0,0.6666666666666666
FQ4WUK1V, The reason ppl say this stupidity is because of population have been vaccinated stop diseases,1.0,1.0
RNP8LUNQ, simple about kids not getting vaccinated Just dont let them into schools and daycare Just like if you board dogs,1.0,1.0
4BCCSCNP, babies return to SantaMonica HS daycare center that closed because of measles ,0.0,0.6666666666666666
8XTHUSBV, I didnt look into the legitimacy of this article So thx But her misinformed harmful views on vaccines still the same,1.0,0.6666666666666666
VIXXMXH1,WhenIWasAKid my mom got me vaccinated because she understood diseases are InvisibleThreat vaccinesNOVA thanksmom nomeaslesforme,1.0,1.0
Q8SZNJW1,Children who receive all vaccines are x more likely to become learning disabled is this guy serious I cant ,1.0,0.6666666666666666
3HK00VJ2,wonderfulhumans who r vaccine brain damaged get double whammy when parents dont know that creating selfexpression pathways is critical,-1.0,0.3333333333333333
VJ8CN0U2,WHO estimates that today immunizations prevent between and million deaths annually and protect many more ,1.0,1.0
9PSHWXTZ,Measles and You and Everyone We Know MakeAFilmUncomfortable,0.0,0.6666666666666666
YL8WKKFX,I would never be at to be a nurse that gives infants or babies vaccinations its honestly the saddest thing,-1.0,0.6666666666666666
90G2WHJ5,Pediatricians urge states to get tough on parents who dont want to vaccinate their kids ,1.0,1.0
Z2M4PH7P, vaccine truth ,-1.0,0.3333333333333333
E2NNCP9J,Like who the fuck says pumped full of mercury and other toxic substances its just a small vaccine tf,1.0,1.0
SVK48MG3, saw your interview wDan Barton Heres a list of ingredients in vaccines ,0.0,1.0
RFYHY2BP, its good if my MMR is so high that every win gives me LP so it basically takes wins in a row to go up in each tier,0.0,1.0
S8AEDT7Y,BOO Measles cases in the US triple in Why Unvaccinated people Yes its that simple ,1.0,0.6666666666666666
CWJ0NT45,It is frightening to see the reemergence of diseases that have not been seen in decades VaccinateYourKids ,1.0,1.0
YY53D8IW,Sht I need vaccinationsimmunizationor whatever they call it I cant go to school til I get my shots Huehue wag nlng magaral ,1.0,1.0
0H6H7VDA, so youll risk say polio do you know the of getting it Not enough to worry we will vaccinate not at m,1.0,0.6666666666666666
3I78QGQH, thousands die from gunsthousands press their MDs for MMR or titersall due irresponsible idiots who put others lives at risk,1.0,0.6666666666666666
MMHWHA13,Do you think cooties are still the same as when we were kids or do you think we need to update the CircleCircleDotDot vaccine,0.0,1.0
IVGU16IW,Im at the County Health office waiting for Yellow Fever vaccination Looking forward to taborwichita Bolivia,1.0,1.0
Z8R6YX1G,Just had Auroras first immunization appointment That was the worst Poor baby ,1.0,0.6666666666666666
8SYFXR56,MT research Q how to persuade parents that MMR vaccine is safe and beneficial A Cant ,0.0,0.6666666666666666
75DHZS8N,Cada Dia Measles is Not a Mild Disease Measles Is Not A Mild Disease I had measles when I was eight years old In those days Ma,0.0,0.6666666666666666
0FMXYUEY,Why you should and shouldnt worry about measles ,0.0,1.0
SDLRWCO0,Pace of new US measles cases slows a bit officials report The number of US measles cases this year has risen to ,0.0,0.6666666666666666
S4J9BY47,Vt officials urge adults to get vaccinated BURLINGTON Vt AP Vermont health officials are urging adults to ,1.0,0.6666666666666666
COV3PQ6A,All those people who havent been vaccinating their kids Youre right You are helping your kids Hope ya got insurance them measles ,1.0,1.0
GY42GGYU, my mmr shows that because Ive only duod with my G friend for like two weeks And alright Ill believe it when I see it lmao,0.0,0.6666666666666666
KAZGBLYJ,Check out this episode FDA NEVER tested if mercury in vaccines responsible for this WOW,0.0,1.0
BE7MD3AQ,Its your choice not to vaccinate your kids But know that choice means youre risking your childs life stupidstupidstupid,1.0,1.0
G8WWOBWK,BART Measles Scare Raises More Vaccination Concerns And Questions About Whos Most Susceptible This weeks warning ,0.0,0.6666666666666666
BSLWSC47, I thought they couldnt get measles,0.0,1.0
ZTBVJIX9,Study of more than kids finds no link between MMR vaccine and autism ,1.0,1.0
ZNCFI833,To the people who dont believe in vaccinating your children Why,1.0,0.6666666666666666
YNPJ9TZH,HEALTH Flu Vaccine Clinics Expand Throughout Our Area By Stephanie StahlPHILADELPHIA CBS The flu emergency ,0.0,0.6666666666666666
QTWX82KI, Maybe he or she has measles,0.0,1.0
PW2OF1BP,Immunizations required before school starts via ,1.0,0.6666666666666666
GJRG9TTL, great vaccine PSA Remember that time you got polio No you dontGet your bleep kid vaccinated,1.0,1.0
GWIYTC34,With Brooks Brothers releasing the Gatsby line i cant help but get hype I cant wait till everyones driving town cars amp getting Measles,0.0,1.0
WLVH34BD,Must watch Vaccines dont cause autism plus the study behind the vaccineautism panic is an authenticated fraud ,1.0,1.0
UZH36Z83,At Michigan Annual Meeting Vaccine update Karen Mitchel MD How to increase your adult and childhood immunizations rates FMRevolution,1.0,0.6666666666666666
CYT0VDFS,San Diego Unified Urges Parents To Vaccinate Kids Californias controversial vaccine requirement law doesnt go ,0.0,0.6666666666666666
UY1918GD, Do they itch and have a little clear center like a blister I say chicken pox or measles,0.0,1.0
LFDWY11E,Facemask time Thiss your fault anti moms RT student infected w measles was on train Rhinebeck ,1.0,0.6666666666666666
5CLKJR99,Kane is all itchy Praying its not measles or chicken pox Concentra Urgent Care in Alexandria VA ,0.0,1.0
RGYUDUYA,Poor kid got shots One not given in Aus one on the US schedule for his age and because USAus use a different vaccine for same thing,1.0,0.6666666666666666
E5DHQTAE,Right wing nutjob aunt sent me an email about autism and vaccines and my reply probably is enough to get me uninvited to family dinners,1.0,0.6666666666666666
7AAUBTSF,When you had a rough night but you back workin again early and your shirt is on point MMR ,0.0,1.0
JFKI1M33, I agree My legs look like I have the measles,0.0,1.0
500UVF6L, they do cant attend school unless vaccinated,0.0,1.0
9MBPKCL1, you dont just endanger your kid but others who couldnt be vaccinated for medical reasons,1.0,1.0
7JR4MYBH,The more vaccines kids getthe sicker they are amp the higher the infant mortality rate You cant poison your way to health,-1.0,0.6666666666666666
Z0NKAV0M, book measles vaccines and lives saved Ask us how at SHRMSTRAT in San Diego where jackcage presents today ,1.0,1.0
9C0867MO,Roald Dahl Wrote This Painful Plea For Vaccinations After His Own Daughter Died Of Measles ,1.0,1.0
EQDOUXQW,Laugh a little to lower your risk Laughing is a natural antidote to stress an immunity booster and a known cancer recovery therapy,0.0,1.0
UXSDC5ZJ,GOD DAMMIT VACCINATE YOUR KIDS,1.0,1.0
GEO7CTMG,Map countries have higher measles immunization rates than the US for yearolds msnbc reiders,0.0,0.6666666666666666
SC48VR3V,Spread the stoke MMR this weekend in AZ love the local scene,0.0,0.6666666666666666
K686PW1H,Senators Feinstein Boxer Push To Reverse Californias Vaccine Exemptions Amid Measles Outbreak ,0.0,0.6666666666666666
HXLVMT0K,Hey be responsible and stop giving the anti vaccine nuts a forum to spread their lies,1.0,1.0
1IA7RSSI,The problem with Obamacare is that vaccines are poisoning our plants and animals,-1.0,1.0
7SF7ZVFX,Help please RT HappyMothering Doctors Change Names of Diseases When Vaccines Do Not Work via ,-1.0,0.6666666666666666
IK37S8QV, my sis in law is antivaccine Im a retired nurse My kidsgrandkids all vaccinated,1.0,1.0
O2R4YB3O,Frieden What works for Ebola is old fashioned public health Says developing vaccine is difficult,0.0,1.0
OPX5SU44, its common sensethose who dont vaccinate children have no regard their kids friends childrens friends amp society atlarge BAM,1.0,1.0
ZK397WFV, Ill rather get a little vaccination than ignore the poor innocent children,1.0,1.0
0LC8BOME,U r not a vaccine denier if u question safety of a vaccine containing mercury aluminum MSG antibiotics formaldehyde CDCwhistleblower,-1.0,1.0
X6YLOP8Q, NEW MUSIC from MMR Jennifair Crack produced by DrumMage ,0.0,1.0
BMHVDG1Q, John Boehner All children ought to be vaccinated For once we agree,1.0,1.0
INJDXP9X,CDC Many US Adults Not Getting Key Vaccines Many US adults are skipping recommended vaccinations that could ,0.0,0.6666666666666666
QB6A0S9C,Maybe if Libitards vaccinated their kids and we didnt let the scum of the earth just walk across the bordermeasles wouldnt be an issue,1.0,1.0
UJ2H9KDJ, Sir Get a science education and stop lying to parents Their kids need to be vaccinated to protect everyone,1.0,1.0
PY6KX0E8, rewards jennymccarthy for her disturbing delusional take on child vaccinations ,1.0,0.6666666666666666
I82O1PHU,Pop up on you like the measles,0.0,1.0
KBH62NE1,Advocacy Group Autism Speaks Urges Parents To Vaccinate Their Kids ,1.0,1.0
I5B4KZH4, ANYONE INTERESTED IN SELLINH MADDEN MOBILE COINS FOLLOW AND DM MELEGIT SELLER AND MMR PRO MEMBERALSO SELLING COINS,0.0,1.0
WAK9CYEU,HB Enroll Motor vehicles providing civil immunity for removing child from motor vehicle using forcible ent ,0.0,1.0
86EWXZGR,See Vaccine Exemptions in Texas by School District The heavily Democratic and rapidly growing Travis County ,0.0,0.6666666666666666
L4XCM5KA,Measles outbreak at Disneyland yikes thank god I dont like Disney lmao,0.0,0.6666666666666666
WFB0ADUY, she was like that my dads like the plague however they do have vaccines for those type of infectious diseases ,0.0,0.6666666666666666
PJAP6Y3N,Current status in a line about deep for dog vaccine Cant board your dog without a vaccine but Crom forbid you get one for your kid,1.0,1.0
SSUYV6ZY,Measles outbreak escalates death of two children confirmed on Solomon Islands cases reported ,0.0,1.0
OOK4GE9M,I hope u get the Measles,0.0,1.0
EFGI50NA,Hearing about measles on bart while Im on bart Fuck,0.0,1.0
93H79C3M,KidPresidentCampaignPromises free kootie vaccination for all,0.0,0.6666666666666666
8T3F4957,If we are supposed to take measles more seriously shouldnt it have a less funny name,0.0,1.0
06W9ODUR,As somebody who had a chord transplant less than a year ago PLEASE VACCINATE YOUR FREAKING KIDS,1.0,1.0
ZOLHJP23, This dude probably didnt get his kids vaccinated either nipples,0.0,0.6666666666666666
9TAGL2LV, On average people who complain live longerReleasing this tension increases immunity and boosts their health ,0.0,1.0
54NSXY4J,Never a boring day this is just two days after the school sent an abundance of emails about measles ,0.0,1.0
28MWBAEA,Pacool kids level got my vaccine shot hahaha ,1.0,1.0
M9YXRJDD,You should not vaccinate your children unless you are absolutely sure you love them,1.0,1.0
KCVXIXI7,The ruts on that MMR ate Frank a time or two nebrasksaisnotflat gravel Murdock Nebraska ,0.0,1.0
CZKCU0CI,The All mighty MMR Music Money Records,0.0,1.0
CM8QKSLG, More cases of measles linked to Disney theme park Wow,0.0,1.0
8D3RCF1P, Vaccinating your children would be a better Mothers Day gift,1.0,1.0
6STAWHNG,In highrisk areas of Pakistan of parents accepted polio vaccine if offered for children endpolio ,1.0,0.6666666666666666
PKSTZSIN,Stop by the office so you can get your hepatitis vaccine Are you kidding me Im gonna die I hate work,1.0,0.6666666666666666
GX16XO4C,theres an episode of law and order on about someone who died from the measles and it just really grinds my gears,0.0,1.0
RZFJG4FF,Ive got it The Breaking Dead Walter White is a walkerbut a super walker that can talk and stuffAnd he has a vaccine to save survivors,0.0,1.0
TORA1LR9, Columbia Health Department says flu vaccines are in as of yesterday,1.0,0.6666666666666666
YD4U8CZ8,Experts California vaccine bill could prevent outbreaks Giving California some of the strictest school ,0.0,0.6666666666666666
6UI7CB3J,My mother is turning into a conspiracy theorist She wants me toGoogle microchips in vaccines She needs to stop reading snopes,1.0,0.6666666666666666
MO5HJNM3,Why Your Dog Can Get Vaccinated Against Lyme Disease And You Cant Most read by neighbors in Nonantum Newton,1.0,0.6666666666666666
NWYJJ7LO,If we should require vaccines shouldnt we check immigrants illegal as well for disease tcot hypocrisy,0.0,0.6666666666666666
IMQE4HA0, Cdc admits to knowing dangers of flu vaccine while pregnant CDCwhistleblower ,-1.0,0.6666666666666666
42RI5W8N,Parents who refuse to vaccinate children to be denied childcare rebates stopavn,0.0,0.6666666666666666
1O8JRVT8,Shit is unreal Measles ass crap Come on Vaccinate your kids Or go live in the woods,1.0,0.6666666666666666
OZE1YYA1,Do I get immunity for killing a few douchebags I mean theyll likely rape someone in the future,0.0,1.0
JA631G63,Flu epidemic sweeps across Texas and states vaccineresistant virus is culprit The Centers for Disease Control ,0.0,1.0
0J7UMAGY,Measles in Arizona Wonderful,0.0,1.0
IJROXEMV,This measles outbreak breaks my heart Why VaccinateYourKids,1.0,0.6666666666666666
7AQE1AT1, Government considers testing anthrax vaccine on children ,0.0,1.0
M4L935MB,YeahBoy Mug Night mixmasterrod mmr dc dj folllow streetsigns graffiti allcity ,0.0,1.0
SW7RN9D2,Like a good neighbor is there only if you refuse to vaccinate your children BadSpokesman ,-1.0,0.3333333333333333
OBLB4BTQ,Measles outbreak grows children urged to vaccinate With California gripped by a measles outbreak Dr Charles ,0.0,0.6666666666666666
TP0MIEXK, TY Fought hard NOT vaccinate my kids Yrs of ppls judgements Dont get hurt get smart,-1.0,0.6666666666666666
N64ALDBE,Why Childhood Vaccines Are Essential ,1.0,1.0
TS1WMWHU, There is a conversation to be had When Jenny McCarthy talks on social she influences parents vaccinating children HealthBCDE,0.0,0.6666666666666666
MQ3I61WR, you gonna tell people the truth about vaccines,-1.0,0.6666666666666666
4L1SENXW,Poor baby Cael got vaccines today my happy boy is tired and grumpy now poor bebe vaccinesmakemommysadtoo,1.0,0.6666666666666666
KX2OGZ7K,This billboard says that adverse reactions to vaccines can lead to shaken baby Thats one I havent heard before,1.0,0.6666666666666666
MOR7ZLXN, measles cases linked to restaurant at MGM Grand Hotel amp Casino in Vegas officials say ,0.0,1.0
YE0L67RI,I use to love slide puzzles as a kid I guess so did spencer immunitychallenge survivor ,0.0,1.0
BITLP4LN,Im so proud My home schooled till highschool Waldorf kids are grown up No vaccines NO ,-1.0,1.0
AQPBOWPU,NC senators file bill to end religious exemptions for childhood vaccines Some North Carolina senators worried ,1.0,0.6666666666666666
PODCZX0J,Good point in child vaccines bill small employr also want to only pay for their kids but they pay for all ,0.0,0.6666666666666666
0V7NL27T, is that how it works Some immunity Youre basically saying people are always at risk even when immunized,-1.0,0.6666666666666666
E3HM3UTN,Im at Mmr Ithaca ,0.0,1.0
N2DB0UAI,Man who contracted measles traveled in Clallam King counties while contagious ,0.0,1.0
