tweet_id,safe_text,label,agreement
8A14EIH4,Only reason why I wouldnt go to Disneyland is cause I dont wanna get measles and I wouldnt have anyone to go with ,0.0,1.0
RRJ8MMCO,Flu vaccine may soon be required for up to kids in NYC Details up next on ,0.0,0.6666666666666666
JGSFIGCM, BART says anyone who rode BART in the East Bay last week should see Dr if any symptoms of measles rash fever cough ,0.0,0.6666666666666666
3QJ6UU9P,HB NEW Health immunizations exemptions from immunization requirements expand statements of exemption to ,1.0,0.6666666666666666
SBT9DPA2, there is no legitimate research connecting vaccine to autism Its a dangerous accusation because it can endanger a childs life,1.0,0.6666666666666666
T6YLJCHK,Vaccines do not cause autism yesonsb vaccineswork,1.0,1.0
ZAS1UAX1,Taking It to Outer space Tonight madhatter mmr dc dj live photoshop flyer connecticutave ,0.0,1.0
K2YXFSSY, duh Child vaccines required Adults are not Come with some real info,1.0,1.0
TFNTLZ33,Whats worse not getting measles shot or going to the hospital on TheWalkingDead,0.0,0.6666666666666666
3NFF69L4, Para nada majo Que desde que te he comenzado a seguir no es masterchef sin tus tuits MMR,0.0,1.0
J3VTEHQF, Yeah vaccines are bullshit All they are is mandatory and legal poison ,-1.0,0.6666666666666666
LQOXR0WT,MT Measles has affected some states more than others And rules for vaccinating vary ,0.0,0.6666666666666666
I32Z82IG,Obama imported ebola and measles while at the same time giving Iran the nuclear option Hmmm,0.0,1.0
6RG3NJ2V,Disneylands measles just made the news here in NC,0.0,1.0
D7MDUA2E,Ive revised my measles position Dont make it illegal not to vaccinate make it illegal to bring your unvaccinated kids in public,1.0,0.6666666666666666
QFRA4MOE,months physical and vaccines Kids amp Teens Medical Group ,1.0,1.0
E67OAXRC,Health Department Issues Statewide Measles Alert NORTH TEXAS State health officials ,0.0,1.0
TVMT8YLL,Nothing makes me more enraged than people who refuse to vaccinate their kids out of a made up fear that it causes autism GetFucked Idiots,1.0,1.0
TOGQ04TS,Taking the baby to her month dr appt for vaccinations Shell NRH ,1.0,1.0
5NUQRZOC, idk I always thought it was a requirement to be fully vaccinated to even go to school epidemic or not,0.0,0.6666666666666666
CYET894Y,Up to Syrian infants die from faulty measles batch via ,0.0,0.6666666666666666
JP21A8RB,Nationalism is an infantile thing It is the measles of mankind Albert Einstein,0.0,1.0
XU6H8O6G,Missing vaccines leads to missing school for kids in many districts By Kendall DowningINDIANAPOLIS Ind ,0.0,0.6666666666666666
97WS7DJH,Amid measles outbreak one crucial group not required to vaccinate While much of the attention in the ongoing ,0.0,0.6666666666666666
B8FZEJKO,If you shopped at the Gilroy Costco Jan pm you may have been exposed to measles KTVU ,0.0,1.0
8RMMXRBT,Use to be Now they got measles Disney used to be a scary place ,0.0,0.6666666666666666
3QNEVLQS, and the truth Always have been told toget the flu vaccine this year I didnt get it,-1.0,0.6666666666666666
N9M0S722,Weird I thought Ben Carson conservative just said all kids should be vaccinated Sigh ,1.0,0.6666666666666666
2Q4U4PDE,American Medical Association endorses ending nonmedical exemptions for vaccinations ,0.0,0.6666666666666666
68SGYYBE, that maybe you shouldnt give those babies vaccines until they are more developed Ya think,-1.0,0.6666666666666666
I2Y8VFJJ,The way God intended California parents are having measles parties instead of vaccinating their kids via ,1.0,0.6666666666666666
U1KBDTPS,To the parent of an unvaccinated child who exposed my atrisk kids to measles via ,1.0,0.6666666666666666
VOB830JI,AndWereBack ThreeBestFriends MMR MyLadies PrettyGirls SundayNight ItsBeenWayTooLong MyLoves ,0.0,1.0
FA489FHV,You should be taken out behind a shed and shot if you dont get your kids vaccinated,1.0,1.0
EMYYS0N5, Theyd also rather reduce herd immunity and have others children die than risk their own child being autistic dolts,1.0,1.0
TCI5NXN3, Yes Vaccines where given to African women amp became sterile afterwardsamp ProVaxxer amp Depopulationalist Bill Gates promotes it,-1.0,1.0
VWWG8DL0,Send a letter to our senate letting them know you are for SB PUBLIC HEALTH VACCINATIONS ,1.0,1.0
FNY3X0VB,Theres a measles outbreak in nyc Do we need to get revaccinated Serious question Anyone know,1.0,0.6666666666666666
25X23TT5,Arizona monitoring hundreds for measles linked to Disneyland via ,0.0,1.0
5HY6756R, in children are wo lifesaving vaccines pls change this amp put immunizationfirst on the Summit agenda,1.0,1.0
AILPZS7I, The promethean enthusiasm is infectious Like measles,0.0,1.0
BEGEMZGT,Damn the whole MOTHA fuckin team out tonight Mmr SkyboxLounge,0.0,1.0
B1IDXKRK,How many kids at a school arent immunized Plano ISD says it cant tell you ,0.0,0.6666666666666666
UEFDDB85, U DO know that vaccinated ppl can get the disease AND spread it dont U,-1.0,1.0
A35TNI6J,Vaccinate your kids for the sake of us all SVU,1.0,1.0
ILX7U8AE, People who complain live longer Releasing tension increases immunity and improves overall health youre immortal,0.0,1.0
4EO8JMLR, I cant My brother had an awful reaction And my friends child developed autism after her first vaccines,-1.0,1.0
42XGM3E5,Come and pray in our MMR Marian Gardens ,0.0,1.0
8TILY3FQ, Hitler had measles when he was six funfact pez,0.0,1.0
QCLJQKSO,Click on this link to donate to our Measles Initiative All proceeds go directly to the American Red Cross ,0.0,0.6666666666666666
7LUK5YPX, Measles outbreak Different states different rules on vaccinations,0.0,0.6666666666666666
HLYTI9OS, that is the differences I personally can testify to in a world pre and post childhood vaccines We dont want to go back,1.0,1.0
H3LD67D2, its so damn selfish especially when some kids with weakened immune systems CANT be vaccinated on the proper schedule,1.0,0.6666666666666666
VJKX31KJ,Dirt Game mmr photoshop flyer dj dc dupontcircle dollarmugnight budlight dig mixmasterrod ,0.0,1.0
1ZWVVRE9, I want measles too,0.0,1.0
NVQ8ZO8L,When did vaccinations for school children stop becoming mandatory WHY WOULD YOU DO THAT vaccinate your kids Seriously,1.0,1.0
02R4UB8A, tweet reactmake a wish i wish i didnt have a cold shire will reverse effect immunimmortality is truth to all in the mind,0.0,1.0
DVXZX8G0, soooo Health Industry can make more money off of measles epidemics than MMR vaccine Who woulda thought,1.0,0.6666666666666666
VGX26HRW,I dont have kids but Ill take yours to get vaccinated if youre too busy,1.0,1.0
6X59MN9R,Presenting on the importance of influenza vaccination Get vaccinated Protect children protect coworkers protect family protect yourself,1.0,1.0
ALV378IW, White House Science says parents should vaccinate their kids I hate that we even still have to clarify,1.0,1.0
N45HNE1H, a thank you MMR mogulwins No Doubt we on the same side ma,0.0,1.0
6SQPLPAL, Even with the vaccine your child is still at risk of catching the disease,0.0,0.6666666666666666
8A83J3DJ,Obama says vaccinate your children Thanks Obama I had just put my st down payment on an iron lung really arrogantignorance,-1.0,0.3333333333333333
KQS5VTQG,What is the vaccination rate at your school Explore the data ,1.0,0.6666666666666666
Q66DV2QC,I got vaccinated when I was a child attending PUBLIC school this was in the late s early s How is this news,1.0,1.0
IH7UKJOP,Not dead virusIts live attenuated Trial expanding Myeloma therapy using measles virus alive and well ,0.0,1.0
NXJ65Y7G,Supporting LD an act to improve childhood vaccination rates in Maine vaccineswork ,1.0,1.0
FY2OB8L4,Pretty cool website about the antivaccine movement Keep this in mind when you start to have kids ,-1.0,0.6666666666666666
4RZWXWTM, Bill that would require more childhood vaccinations dies Too bad,1.0,0.6666666666666666
8PEEJ4US, vaccinations must be a requirement there are many infants who can not be vaccinated R u guys willing to risk their lifes,1.0,1.0
3CM9P1N2,Plano ISD barred from releasing immunization statistics despite measles threat ,0.0,1.0
9SDHC02U, Thats what Id heard too Shows just how contagious Measles is ,0.0,1.0
UXX4K1R1,Nah RT Everyone gt months should get the flu vaccine especially ppl wchronic diseases the elderly amp the immunocompromised,1.0,0.6666666666666666
QGC3RHQY,dont get measles ,0.0,0.6666666666666666
LVJTQP6B,W I T MY W O E S CREWLOVE jennifair mmr smoknfaces somage mogulmedia nyc chicago Taj ,0.0,1.0
XY8VQKWN,My arm is killing meeeeeee Stupid typhoid vaccine,1.0,0.6666666666666666
S7IB065S,Officials measles cases confirmed in Illinois Six cases of measles have been confirmed in Illinois including ,0.0,1.0
QSVRKSRD, The HIB vaccine alone has virtually eliminated the huge death rate in infants of bacterial meningitis All of us caring infants,1.0,1.0
K3WJUC2E,New Choices For Seasonal Flu Vaccines WebMD Health NewsBy Brenda Goodman MAReviewed by Michael W Smith ,0.0,1.0
TSOMOJ55,Next Stop JerseyGirlsOnFridays MMR Swagg,0.0,1.0
Y5LXGP4H,Vaccination day Now my babies are safe Dia de vacinao Agora meus bebs esto a ,1.0,1.0
OOIOERYG,At this convenient care clinic clinic to get Immunizations needed for nursing school and there are some real characters in here,0.0,0.6666666666666666
53Q49VRW,Childrens Museum of Houston to Offer Free Vaccinations ,1.0,0.6666666666666666
BCE8E4A9,CDC Measles Cases In US Since January The number of US Measles cases this year is growing The CDC says ,0.0,1.0
URKVQ5RF, Its like asking would you rather have the chickenpox or the measles,0.0,1.0
LER88GRL, Its also not an argument Vaccinations are a HUGE government money makernot for our well being BS based in lies,-1.0,0.6666666666666666
9ANI1IJD, she just adopted a baby full bred German shepherd because owners didnt vaccinate he got parvo so they said,0.0,1.0
0DU92X27,FYI All you people who dont believe in vaccinations are the reason for the measles outbreak,1.0,1.0
FPKP7QLI, Measles Vaccination Rates Tanzania Does Better Than US ,1.0,0.6666666666666666
35IBZC58,We the new killer bees swarming the cipher my lyrics are hyper to find the vaccine to this EMCEE disease yall HIV and Im Magic,0.0,0.6666666666666666
JILK6OUB,Just vaccinate your kids And yourself And at least do your research before arguing ,1.0,1.0
T09Q1BZ7, His health science advisor on vaccines is Need I say more really ROFLMAO ,0.0,0.6666666666666666
0GY120L8,RT We can prevent another measles outbreak from occurring through some simple steps ,0.0,0.6666666666666666
IB0T965A,Dont use your kids as your ante for your conspiracies RT Seems like a good time to remind everyone vaccinate your kids,1.0,0.6666666666666666
AKN06FV7,followdatbag followyourdreamsbutdontsleep my bro djhpnotiq teamfollowdatbag MMR FDBDJ datbag ,0.0,1.0
0CUJLJYB,IM FUDGING COMING DOWN W A COLD ON TOP OF ALL THIS I HOPE I DONT GET MEASLES,0.0,1.0
LKC9N86Q,I swear yall freakin dirty elementary kids w the measles better stay home I better not see measles spread to start ,0.0,0.6666666666666666
XISOC4AI,FOD Release Party MMR TheCampaign rydethawave Mixtape Release as well BlackampGold ,0.0,1.0
F64ZL1IK, Study published on alleged link between vaccines and autism removed pending further investigation ,0.0,0.6666666666666666
MDE7INXJ,New Jersey school to offer workers hepatitis A vaccine Teachers and employees at Passaic High School are being ,1.0,0.6666666666666666
IJ5CEUSC, month check up vaccines vaccines my baby Batta Pediatric Clinic ,1.0,0.6666666666666666
OQ5A006X,Measles schmeasles You cant stop us Disneyland ,0.0,1.0
K6A6UUEE,Measles People are getting measles in Disney Land Gut instinct is to blame antivaxxers but let me research this a bit first,0.0,0.6666666666666666
PVHX3E4I,McKinney offers free immunizations for uninsured children No appointment is necessary but bring a copy of the ,1.0,0.6666666666666666
EH6LZXL3,At this point yall better know its spirit week which means I get immunity from weird looks when I show up at school in full xosume ok Ok,0.0,1.0
5GLNLXNT,jennifair behind the scene footage mmr mixtape Brooklyn Chicago ,0.0,1.0
XFHW00IA, Why is it fair for antivax taxpayers be denied enrollment tax support schools amp the Vaccine Injury Compensation Program,-1.0,0.6666666666666666
FFJQ2Q4N, So the expenditure of money is comparable to a capital crime Doesnt RFK Jr have some vaccine lies to spread or something,-1.0,0.3333333333333333
CXITWF17,Measles outbreak on both coasts thanks to science deniers refusing to vaccinate their children States need to stop stupid ppl from this,1.0,0.6666666666666666
2UHI3UXH,Childrens Museum of Houston to Offer Free Vaccinations ,1.0,0.6666666666666666
V81EJS9G,Kids cant bring PB crackers to school but OK to bring measles IN allows optouts for vaccinations ,1.0,1.0
WJBE3IYL, thanks to Dr Offit for an enlighting talk about measles outbreak at the NJ AAP conference,0.0,1.0
RFAU606S,You tell them vaccines DO NOT cause autism KellyFile DontHateVaccinate knowledgeispower vaccineswork MeaslesOutbreak,1.0,0.6666666666666666
9ZUS4F1Q, servings of measles please Youre cleared to descend to Pilots Grill for a plane great burger ,0.0,1.0
517OP4VW,Measles cases at year high because parents are failing to get children vaccinated ,1.0,0.6666666666666666
8KBWNNET,VACCINATE YOUR KIDS PLZ THX A case of whooping cough has been reported at Carmel High School ,1.0,1.0
XK6TBOB7,I hate you measles Signed Everyone,0.0,1.0
LSW9QKJA, CEO says measles outbreak not hurting attendance ,0.0,1.0
WFXC2FQM, Does current measles outbreak have roots in reckless congressional oversight,0.0,1.0
KBA9722B, This is the measles R for general population ,0.0,1.0
47ML6NVS,Measles exposure warning sign at dont we vaccinate for that ,1.0,0.6666666666666666
CJPNXU1U,I know people who dont want to vaccinate themselvesbaby And Im like babies get whooping cough straight from the mother amp its fatal,1.0,1.0
MM43VXMI,Some Disney Employees Test Positive For Measles Theme Park Confirms ,0.0,1.0
D75JAQ5R, yup Babies too young to be vaccinated get sick bc grownups opt out of public health,1.0,1.0
NU6WPMZ6,Why is there an actual debate on vaccinating your kids Its a nobrainer Like calling running plays from the halfyard line,1.0,1.0
PYVCEFK0, your propaganda amp childish imagery is laughable it appears the establishment is portraying these traits U have it twisted,0.0,1.0
Q3SOF7AJ,Nothing like killing ourselves w our own fear MT Vaccine fears have fueled the resurgence of preventable diseases,1.0,0.6666666666666666
PSEXC6AW,MEASLES NEWS FLASH cont Many of those illegal aliens had many diseases amp were then dispersed around the USA without even being examined,0.0,1.0
E9ERSOLG, yeah after the top hold they were looking good and then it all fell apart Oh well MMR danlpredictions,0.0,1.0
LFV3T4NZ, Ebola is made up to scare the public into eventually taking another vaccinenot sending to find that shit,-1.0,0.6666666666666666
LLC7MB86,So apparently there has been a measles breakout at Disneyland,0.0,1.0
JO7HWEKF,So scary daycare infants quarantined after baby contracts measles via ,0.0,0.6666666666666666
3V7PSM0X,power control and greed harmed our future generation stopthemadness and bless vaccine injured CDCWhistlebower demand truth,-1.0,0.6666666666666666
OM7DA3O2,DeSoto schools remind families to update student immunizations ,1.0,0.6666666666666666
JYWBKNPD, Thanks for sharing I remember getting vaccines as a child and perhaps maybe thats why Im fighting Lupus Interesting,-1.0,0.6666666666666666
Q60RWEDV,CNN Mom Family that refused vaccination put my baby in quarantine ,1.0,0.6666666666666666
5ZJ5H4P9,We had sailed years when the measles broke out and the ship lost its way in the fog damnantivaxxers,1.0,0.6666666666666666
92LJEJLB,I may not be a parent but with where I work it just makes me so mad that a parent refuses to vaccinate there child simply because they may,1.0,1.0
XKUSFLQ6,VACCINATE YOUR KIDS nomeasles ,1.0,1.0
R42BSCZ7,Best defense against diseases is to nurture and maintain your own immunity Good nutrition and diet will do it ,-1.0,0.6666666666666666
DPTDFSAQ, now a days people punish their kids by letting them get measles,1.0,0.6666666666666666
7V2HKAZY, Fortunate to not have a child who was perfectly normal until vaccinations amp sudden autism takes over wno other explanation,-1.0,1.0
NQMT5C70,My party affiliation has never influenced whether I vaccinated my kids People who think its a liberal thing are idiots I vaccinated,1.0,1.0
BHABJM0Q,If you think vaccinations cause autism youre the dumbest motherfucker I know,1.0,1.0
JVJB6SVC,Object lesson re not vaccinating harrowing story of measles infection ,1.0,1.0
ZFL2WDJ0, both coasts had free measles shots today for CMs,1.0,0.6666666666666666
594YU842, I choose not to vaccinate my kids and my klonopin amp ambien make me feel good about it,-1.0,0.6666666666666666
HPSVH8UH, maternal mortality rate AND the highest infant mortality rate among developed countries And the MMR in the US is going ,0.0,0.6666666666666666
EK8LIQM4,Super Immunity Soup in my glass No spoon needed this is instant health amp so delicious I decided just ,0.0,1.0
TD0BWCG3,But AUTISM amirite RT Vaccines work These charts prove it ,-1.0,0.3333333333333333
8P51VN1A,Just took advantage of the free childrens immunizations that Thurston County gives each year This is the way to go,1.0,1.0
NW4HYQMN,Truth re vaccines amp autism Hint Science knows via ,-1.0,0.6666666666666666
O8L0GVFU,Vaccine Critics Turn Defensive Over Measles And all because of a study proven false,1.0,0.6666666666666666
7UPOFMQR,Apparently when I was a baby I rejected like all of my vaccines Yay me,0.0,0.6666666666666666
6XTJ9JPY,Shout out to my billet mom for saving lives daily surviving the measles and for being in the Navy myhero bejealous,0.0,1.0
3JZNLHA9,pls dont glare at me after I cough like I have a sinus infection not measles swerve bitch,0.0,1.0
BY7TVJCS, vaccine shots for Africa So scared Ahhh Piedmont Hospital ,-1.0,0.3333333333333333
DEGZO4QP,Sandyhook was real wasnt led by the Jews Darren wilson is a murderer amp MMR vax doesnt cause autism todayisfestivus,1.0,1.0
4HWFYXPT, Disney Measles and the Fantasyland of Vaccine Perfection if only id been able to read this in ,-1.0,0.3333333333333333
E80FYBRG,Thanks to our awesome school nurses and student services staff for getting students in compliance with the new immunization requirements,1.0,1.0
GSMEDVHP, Africans die of Ebola the world says there is no cure Americans fall ill of the same disease a vaccine pops up,0.0,0.6666666666666666
J94KPVN4,ZERO legit med reason not vaccinate yr kids wrong them amp any theyre in contact w ,1.0,1.0
LV3Z8YKZ, Or take immunization advice from a crazy actress but believe pediatricians are conspiring to hurt children,1.0,1.0
UZ9KEBHT,Attacks on polio vaccination teams continue in Pakistan more healthworkers found dead vaccineswork,0.0,0.6666666666666666
F8RFDMIX,So true Antivaxxers are putting all of our kids at risk vaccineswork ,1.0,1.0
YV402XI5, Travelers at SeaTac possibly exposed to measles Uhoh,0.0,1.0
NY8D009N,Can you say overbooked GoingBackToBed California Department of Public Health Immunization Branch ,0.0,1.0
9H7YID65,How to think about the risk of autism A nice piece in the debunking false theories related to vaccines ,1.0,0.6666666666666666
GTFDULSP, Roald Dahl lost a daughter to measles ,0.0,1.0
0GYLUVQ2,For example Bill Gates himself said the world population needs to be controlled they gave defected vaccines to thousands African children,-1.0,0.6666666666666666
JCBVUNH8,Does anyone have a good recent empirical citation about the importance of childhood immunizations,0.0,0.6666666666666666
GYVGZ9V1,MT of the lucky K Help You Understand The Current Measles Outbreak ,1.0,0.6666666666666666
13WK49EA,MMR jab warning as measles cases soar over Easter ,0.0,0.6666666666666666
HRAH3LXZ,OK For the last time Bottom line Vaccines are safe and save lives and they do not cause autism ,1.0,1.0
8OJVXBFK,Arizona and Pinal County health officials confirm eight more cases of measles total of cases confirmed ,0.0,1.0
5ZS09KKW,Measles will never have anything on good ol ebola nice try cnn,-1.0,0.3333333333333333
255FB0Q2,TheDoctors I had measles as a child very scary Why put your child through that,1.0,1.0
XLA9CL37, Thank you for standing with CA parents and their children in support of vaccineswork,1.0,1.0
S0V0YA14, they thought he had the measles,0.0,1.0
BO1XXP15,And not get measles,0.0,0.6666666666666666
E3WT59OR,you want the freedom to not vaccinate your kids tough shit you want to maintain an arsenal of automatic weapons again thats too bad,1.0,1.0
JMN392L8, Idiots wont use condoms in risky situations An AIDS vaccine would be a good start Flu vaccine cant cover all,1.0,1.0
J6KP7WJS, I just watched the melon drop It was definitely better than whatever Jenny Measles is doing,0.0,1.0
G1UF5OXJ,You I thought measles were a thing of the past Other Voices What Texas Editors Are Saying ,1.0,0.6666666666666666
KEBPVA9N,Ridiculous There were measles cases in the US in Last year there were ,0.0,0.6666666666666666
JIZO0OV9,How soon is too soon for building up your childs immunity to iocaine powder AskingForAFriend,0.0,1.0
M4YRGBVO,Austerity is not a Vaccine to Crisis It is a Parasite with Pandemic Potential It Drains Life Killing Slowly OccupyDC,0.0,1.0
9W04M06U,Not only did this kid get vaccines today but he is sick with a terrible cold Somehow he is smiling ,1.0,0.6666666666666666
E80YNWAS,problem w almost eradicating measles in generations is weve got people who dont know how awful the disease is and its still here,1.0,1.0
NJLA0X40,Competition today Last time performing on this field of course Im going out w a bang amp superior MMR finna take home EVERYTHING,0.0,1.0
4S2I8PPD,This bitch leaking Tatar sauce mayonnaise cottage cheese health dept need to be getting a vaccine stronger than Ebola bitch foh,1.0,0.6666666666666666
W8QGDZUS, All California schools have been advised to close for Friday the due to a measles outbreak ,0.0,1.0
LKBITNYD, In a groundbreaking case doctors may have found a potential cure for cancer the measles virus ,0.0,1.0
Q2PN68OW,Dont want to vaccinate your kids fine Just dont bring the little plague rats to Disneyland asshats,1.0,1.0
WRN26JTD, whooping coughor a child dying yes dying of measles What the hell is wrong with you,0.0,0.6666666666666666
0KGXCECT, mmr is the movement,1.0,0.6666666666666666
MIGFG6WR, the importance of vaccinations Or the Disney measles outbreak this could just be me though Yay college Idk wats goin on,1.0,1.0
M38M0KFB, Yes measles was wiped out amp because new moms didnt see new cases they didnt vaccinate their children Now they have no defense,1.0,1.0
LVG4LT28,Novant Health to require flu vaccinations for hospital employees volunteers vendors It is the first hospital ,1.0,0.6666666666666666
81N4TQNW, youll enjoy this its about bad parents who dont vaccinate their children ,1.0,1.0
G29VX9KV,German measles officially eliminated in North South America Health officials say the first region of the world to ,0.0,0.6666666666666666
3TVKOS7H,S NEW Provides immunity from liability for certain recreational activities and from injuries caused by acts ,0.0,1.0
6E4KZTPT, But the Mercury was removed from the vaccines,1.0,0.6666666666666666
PVYU6FMX, Two more Johnson County children have measles ,0.0,1.0
BXQVU52M,Immunity Smoothie Kefir fresh turmeric pineapple maca powder ground flaxseed and baby carrots ,0.0,0.6666666666666666
2GLWULVO,Cant wait til my nigga arrives Its going down once that happens Chitown to NYC MMR,0.0,1.0
PRX8HJX5,The outbreaks from measles seem to be similar to our worries about Ebola not good,0.0,1.0
UG2MUDMZ,Childrens Museum of Houston to Offer Free Vaccinations ,1.0,0.6666666666666666
1Z3YVWO4, Facebook is where my friends from college share baby tips vaccine conspiracies and stories from hoax news sites Seriously,1.0,0.6666666666666666
BE2C90J6,On average people who complain live longer Releasing this tension increases immunity and boosts their health Im gonna live forever,0.0,1.0
F9185YMK,In relation to my other tweet I definitely believe you should vaccinate your kids,1.0,1.0
J5IL5OEK,Giving children vaccines is giving them their rights Dr Mkopi ,1.0,1.0
D7F2ZAHV,Dont be an idiot Vaccinate your future freaking kids people Microbiology professor ,1.0,1.0
T46VNPQM,At my grade school doing a service project for Martin Luther king day MMR,0.0,1.0
7Q0EL4QI, Measles and mumps are making a comeback amid vaccination backlash how strange,1.0,1.0
XWBZAQL2,How do he compare vaccination to the Holocaust thats the craziest thing Eva Do this man even have kids TheDoctors,1.0,1.0
1QVZ9C7J,Frequent complainers on average tend to live longer It boosts the health and immunity by releasing stress and tension YAY ME ,0.0,1.0
WEGBFF0H,VaccinesWork gt Reasons Why No One Should Ever Vaccinate Their Kids by via ,-1.0,1.0
88Q5VSUM,NV can do better Which states are the best and worst at vaccinating their kids ,1.0,1.0
QK5Y1ZWX,Dont let the schools tell you to vaccinate your children,-1.0,0.6666666666666666
ERL3HFEQ, measles girl,0.0,1.0
EHP7IFHO, so by your logic if all measles vaccinations stopped today there would be no adverse public health issue,1.0,1.0
IER9HEXS, GOP STOP blaming Immigrants first Ebola now measles Which diseasesbrought their ancestors AINF ,0.0,0.6666666666666666
6O0Y8M8L,Shots time yet again Central District Health immunizations ,1.0,0.6666666666666666
8304GWXG,You should stick to what your good at even if its loligaging and pranks and leave Health Care and ACTUAL VACCINES TO HEALTH CARE INDUSTRY,0.0,0.6666666666666666
42EQ6PQO,A man walked into hospitals in RI w measles potentially infecting other patients Ill be live w the story ,0.0,1.0
2CWJQ23X, find a common definition of fascism that applies to democratically elected government forcing vaccination for public health,-1.0,1.0
BAH02AI3,Welcome to California We has measles ,0.0,1.0
